{
  "year_name": "2025/2026",
  "start_date": "2025-09-02",
  "end_date": "2026-07-23",
  "is_current": true,
  "terms": [
    {
      "term_name": "Term 1",
      "start_date": "2025-09-02",
      "end_date": "2025-12-18",
      "vacation_date": "2025-12-19",
      "resumption_date": "2026-01-08",
      "is_active": false,
      "midterm_breaks": [
        {
          "start_date": "2025-10-31",
          "end_date": "2025-11-03",
          "description": "Term 1 mid-term break"
        }
      ],
      "milestones": []
    },
    {
      "term_name": "Term 2",
      "start_date": "2026-01-08",
      "end_date": "2026-04-01",
      "vacation_date": "2026-04-02",
      "resumption_date": "2026-04-21",
      "is_active": false,
      "midterm_breaks": [],
      "milestones": []
    },
    {
      "term_name": "Term 3",
      "start_date": "2026-04-21",
      "end_date": "2026-07-23",
      "vacation_date": "2026-07-24",
      "resumption_date": "2026-09-02",
      "is_active": true,
      "midterm_breaks": [],
      "milestones": [
        {
          "name": "BECE Exams (JHS3)",
          "start_date": "2026-05-04",
          "end_date": "2026-05-11",
          "description": "Basic Education Certificate Examination (JHS3) window"
        }
      ]
    }
  ],
  "notes": "Dates approximate - subject to change. Use admin UI to adjust exact term dates."
}
